{
  "$schema": "http://json-schema.org/draft-07/schema#",
  "$id": "https://github.com/ni-sh-a-char/ni_sh_a.char-IDE/languages/schema.json",
  "title": "ni_sh_a.char-IDE language definition",
  "description": "One file per language. Adding a language means adding one of these -- no source code changes.",
  "type": "object",
  "required": [
    "id",
    "name",
    "extensions",
    "run",
    "template"
  ],
  "additionalProperties": false,
  "properties": {
    "$schema": {
      "type": "string"
    },
    "id": {
      "type": "string",
      "pattern": "^[a-z0-9][a-z0-9_-]*$",
      "description": "Unique lowercase identifier. Must match the filename."
    },
    "name": {
      "type": "string",
      "minLength": 1,
      "description": "Human-readable display name, e.g. 'C++'."
    },
    "aliases": {
      "type": "array",
      "items": {
        "type": "string",
        "pattern": "^[a-z0-9][a-z0-9_+#-]*$"
      },
      "description": "Alternative names users may type, e.g. ['py', 'python3']."
    },
    "extensions": {
      "type": "array",
      "minItems": 1,
      "items": {
        "type": "string",
        "pattern": "^\\.[A-Za-z0-9.]+$"
      },
      "description": "File extensions, leading dot included."
    },
    "comment": {
      "type": "string",
      "description": "Line-comment prefix, used by the editor for toggle-comment."
    },
    "highlight": {
      "type": "string",
      "description": "Syntax highlighting mode id used by the web editor."
    },
    "image": {
      "type": "string",
      "description": "Container image for the sandboxed Docker runner."
    },
    "setup": {
      "type": "array",
      "items": {
        "$ref": "#/definitions/argv"
      },
      "description": "Commands run inside the container before the program. Docker tier only."
    },
    "compile": {
      "type": "array",
      "items": {
        "$ref": "#/definitions/argv"
      },
      "description": "Compile steps run in order before 'run'. Omit for interpreted languages."
    },
    "run": {
      "$ref": "#/definitions/argv",
      "description": "The command that executes the program."
    },
    "browser": {
      "type": "string",
      "enum": [
        "pyodide",
        "native"
      ],
      "description": "In-browser (tier 0) engine, if this language can run with no backend."
    },
    "template": {
      "type": "string",
      "minLength": 1,
      "description": "Hello-world starter shown when the language is selected."
    },
    "website": {
      "type": "string",
      "format": "uri",
      "description": "Official homepage for the language."
    },
    "filename": {
      "type": "string",
      "pattern": "^[A-Za-z0-9_.-]+$",
      "description": "Exact source filename to write, when the toolchain requires one (e.g. Java needs Main.java). Defaults to main<first extension>."
    }
  },
  "definitions": {
    "argv": {
      "type": "array",
      "minItems": 1,
      "items": {
        "type": "string"
      },
      "description": "Argument vector. Never a shell string -- arguments are passed directly, so no shell quoting or injection is possible. Supported placeholders: {file} source path, {bin} compiled output path, {dir} workspace directory, {stem} filename without extension."
    }
  }
}
